name,meaning,Special Occasions,scientific_name
Alstroemeria,"bold look alstroemeria hints at depth symbolism behind petals. tropical beauty means devotion and mutual support, between two family members or friends friendship on broad scale from acquaintanceship life long buds withstanding trials everyday life building your personal life by finding new friends and potential romantic connections following your dreams and achieving your aspirations, both in material and spiritual sense.","celebrate an anniversary your friendship with life long best friend by handing over giant bouquet colorful alstroemeria blossoms. you’ll really impress an acquaintance who helped you out tight spot with gift single flower as well. if you’re not sure kind flowers give family member for birthday, bloom perfect for purpose as well. alstroemeria flower’s message is… alstroemeria flower’s message hold your friends close and show them how much you cherish them. build new relationships branch out and develop healthy social support network. chase your dreams and don’t give up until you achieve them.",
Amaryllis,"since plants so large, they seem call attention themselves by towering over other nearby flowers. they first came attention european gardeners in 1800s. they seemed awfully grand victorians, so they became associated with pride. however, calling someone “full pride” was often compliment in victorian times. prideful women were often thought be beautiful.",,
Anemone,"beautiful anemone flower symbolizes: protection against evil and ill wishes approach rain storm petals close up forsaken or forgotten love and affection anticipation and excitement for something in future fairies and their magical world twilight death loved one or loss them someone else protection against disease and illness arrival first spring winds bad luck or ill omens despite its delicate beauty, anemone developed mixed set meanings depending on culture viewing flower. some see as protection against disease, while others feel opposite way and warn against as an omen impending illness.","with such variety different meanings, you use anemone flowers for occasions like: funeral or memorial for loved one passed away bouquet for someone looking forward big move, marriage, or birth baby stay well gift for anyone trying avoid illness wishing someone good luck anemone flower’s message is… look forward future and don’t forsake ones you love. something new always around corner, no matter how dark things might look right now.",
Anthurium Flower.Txt,"tropical plant adapts nearly any environment and produces new flowers all year, giving reputation as hospitality plant. but, other meanings too. hospitality happiness abundance","anthurium flowers appropriate for nearly an occasion and lend tropical touch floral displays. they be used in wedding décor, for graduations and promotions, or for other celebrations. flowers suitable in mixed arrangements and floral displays or all kinds. although they not an official birth flower for any month, they suitable for expressing birthday wishes.the flowers typically used in mixed bouquets, but be used singly. anthurium flower’s message is… anthurium flower’s message one hospitality and abundance making them an ideal potted plant present at housewarmings or even at retirement celebrations.",
Aster,patience love variety elegance daintiness afterthought (or wish things happened differently),,Aster
Azalea,"azalea tends represent good qualities personalities, but also symbolizes specific emotions or events. many people feel flower means: remembering your home with fondness or wishing return taking care yourself and your family temperance – victorians often carried bloom if they supported prohibition alcohol, but also represents emotional evenness passion still developing and fragile elegance and wealth femininity and feminine beauty abundance, especially beauty or intelligence death threat – only sent in black vase despite being an overwhelmingly positive plant, azaleas still have dark side due association with death threats.","give gift azaleas for: birthdays falling between may 20 and june 20 celebrations for women in your life urging temperance in someone who going excesses telling your family you wish you visit home reminding someone take care themselves azalea flower’s message is… care for yourself and those around you. never forget where you came from, and stay in control your emotions and actions for success in life.",Rhododendron
Baby Breath Flower.Txt,"many people have marveled at baby’s breath peeking out their corsage without knowing deeper meaning behind it. these bright white dots symbolize everlasting and undying love, including family, platonic, and romantic bonds pureness and freedom from outside influences or corruption power holy spirit in christian faith innocence newborn babies either gender reconnecting with lost loves or disconnected family members self discipline and ability stay focused on love.",include baby’s breath in your wedding arrangements baby shower gifts bouquets for children and other innocent individuals. baby breath flower’s message is… baby breath flower’s message stick with your loved ones and show them your dedication. stay dedicated your cause and remember power innocence.,
Begonia Flower.Txt,does begonia flower mean? begonia symbolizes warnings about future misfortunes or challenges dark and unpleasant thoughts distract you from your happiness and joy being cautious about new situations harmonious communications between friends and family members gratitude and giving thanks for favor from someone else individuality and standing out from crowd justice and peace between major world powers and simple people alike.,"trying warn someone watch out? pot living begonias perfect gift for sending message. you also bridge divide and start new friendship with these flowers, or celebrate success friend who been struggling. begonia flower’s message is… begonia flower’s message don’t be lulled into false sense security and stay vigilant for danger. always repay favors given you with appropriate gifts or you’ll end up with no help at all.",
Bird Of Paradise,"as one more unusual looking flowers used for arranging and bouquets, bird flower carries symbolism such as: 9 th wedding anniversary for married couple freedom and ability travel, due flower’s resemblance birds in flight magnificence, excellence and success royalty and regal bearing paradise on earth joy through challenges and successes alike faithfulness in romantic relationships optimism towards future movement suggested by spiked petals brings mind flock birds gracefully departing. it’s not hard see why it’s developed such long list different meanings.","wondering splurge on big bird paradise as gift for someone else? stick with an appropriate occasion like: birthdays, especially for adults already have everything else congratulating someone on promotion, graduation, or other success celebrating handling sticky situation in graceful way birth and relocation announcements, or any celebration new beginning farewell parties for people departing on long trips bird paradise flower’s message is… stay open new possibilities and seek your freedom wherever you find it. explore world with sense optimism and excitement.",Strelitzia
Bleeding Heart,"eye catching flower carries meanings like: expressing your emotions openly deep and passionate love between two people spurned or rejected love, especially in eastern cultures where flower originated being too sensitive or emotionally reactive world around you feeling compassion and unconditional love for everything in creation connection goes beyond life and death while flower grew wild for thousands years throughout asia, was only developed and bred few hundred years ago and didn’t arrive in western culture until 1800s. limits number potential meanings for bleeding heart, giving more focused purpose.",celebrate with bleeding heart by: inserting sprigs flower into wedding bouquets and table decorations exchanging flowers with your spouse or partner on valentine’s day giving potted plant friend after bad breakup memorializing lost loved one with pure white bleeding hearts bleeding heart flower’s message is… even sorrow lead beauty if you willing deal with your emotions. watch out for scorned love and save your affections for someone who appreciates and returns them instead.,Dicentra
Buttercup,"buttercup flower more than kid’s flower and symbolism its own. under normal circumstances, buttercup means: humility neatness childishness “your charm dazzles me.”",buttercups appropriate for informal entertaining and gift giving. consider buttercups in combination with other wildflowers for these special occasions. welcome home celebrations housewarmings friendship bouquets family reunions buttercup flower’s message is: buttercup flower’s message typically one joy and cheerfulness and especially appropriate for those who love wildflowers.the buttercup be seen as symbol goodwill towards recipient. buttercups be tucked into vases with daisies and other wildflowers add bright color bouquet.,Ranunculus
Cactus,"elusive and surprising cactus flower means lust and sexual attraction between two people power and loneliness desert enduring all things, no matter how painful or difficult protection from danger and threats warmth and care, especially from mother child chastity and abstinence from physical contact","don’t be afraid give blooming cactus as gift for your child’s birthday, as long as they restrain urge feel spines inspiring friend who facing their own metaphorical or literal journey into desert celebrating recovery from addiction or physical injury reminding yourself thrive in your environment instead just surviving. cactus flower’s message is… cactus flower’s message don’t let world bring you down. everything you need inside you, and you too produce beautiful things in middle an empty desert.",
Calla Lily Meaning.Txt,"flower not technically part real lily family. instead, it’s different type flower with bloom similar other true lilies. most common meanings bloom include magnificent and overwhelming beauty, in classic victorian language flowers and ancient greek tradition resurrection and rebirth, since plant returns each year after winter faith and purity, especially in christian religions overcoming challenges, since cut flowers start regrowing in vase and survive frosts liveliness and innocence youth.","calla lilies make appropriate gifts for many religious holidays due associations with virgin mary and jesus. aside from those occasions, consider giving gift flowers for birth new baby or child’s birthday. you also try celebrating loved one’s success at work with bunch orange or yellow blooms. calla lily flower’s message is… calla lily flower’s message focus on beauty around you, and remember will return even if disappears for season. hold onto your innocence and grace as you move through world and conquer your challenges.",
Camellia,camellia flower speaks heart and expresses positive feelings. it’s most common meanings are: desire or passion refinement perfection & excellence faithfulness & longevity,,
Carnation,"carnation means depends on circumstances and color symbolism bloom, but some common meanings apply all carnations. love fascination distinction","carnations appropriate for nearly any occasion, as they symbol both love and distinction. carnation in school colors often presented graduates or recipients academic and sports awards. pink carnations popular for mother’s day while green carnation prized on st. patrick’s day. carnation flower’s message is… carnation flower’s message as individual as recipient is. while they all symbolize love, distinction and fascination, you tailor your message by color you choose.",Dianthus
Chrysanthemum,"as bloom great importance, chrysanthemum symbolizes concepts like: lasting friendship and non-romantic affection support from your family and loved ones cheerfulness and good spirits, including cheering up sad person rest and recovery after long trial or challenge enduring life and rebirth, especially birth child loyalty and devotion, both romantic and platonic",,Chrysanthemum
Columbine,"does columbine flower mean? not surprisingly, columbine flower means different things different cultures. ancient greeks and romans attributed plant aphrodite, goddess love. other meanings include: fool – columbine flower thought resemble hat court jester three columbine flowers in one composition symbolizes faith, hope and love victorian meaning columbine is: resolved win",,Aquilegia
Crocus,crocus symbol . . . cheerfulness gladness youthfulness mirthfulness glee crocus flower primarily associated with mirthfulness and glee associated with youth. flower an uplifting and cheerful affect.,crocus perfect flower for spring bouquets and appropriate as gift between friends or celebrate birthdays and other special occasions. an appropriate flower for young girls. crocus flower’s message is: crocus flower’s message one joy and cheerfulness celebrates return spring.,
Daffodil,"while daffodil’s primary symbolism new beginnings, rebirth and coming spring, many others. some most common meanings for daffodil flower are: creativity inspiration renewal and vitality awareness and inner reflection memory forgiveness",,Narcissus
Dahlia,"common dahlia symbolizes staying graceful under pressure, especially in challenging situations drawing upon inner strength succeed traveling and making major life change in positive way standing out from crowd and following your own unique path staying kind despite being tested by certain life events finding balance between adventure and relaxation commitment another person or certain ideal warning someone about potential betrayal. course, meaning an individual dahlia bloom also dependent on its color.",,
Daisy,"at first, seem be as many meanings for daisies as species daisies. however, most generally accepted meanings are: innocence, especially with white daisies with yellow or pale centers. purity – also shown by daisies as white as possible. new beginnings, which why they often found in bouquets for new mothers or as gifts for children. true love – because each daisy flower really two flowers blended together in harmony. sender keep secret. keeping secret one way person exhibit they truly love another. entomological meaning daisy flower modern english word daisy comes from an old english word that’s impossible spell and next impossible pronounce. important thing old english word meant “day’s eye” because daisy flowers only opened during daytime. “daisy” also became slang word for something excellent quality, as shown in books printed in early 1800s. over generations, “that’s daisy” became changed “that’s doozy.” symbolism daisy flower in modern paganism, daisies symbolize sun just because they seem appear like stars or suns. in victorian times, different species daisies symbolized different things: michaelmas daisy (aster amellus) symbolizes farewell or departure. gerber daises (those in gerbera genera) symbolize cheerfulness. they were often paired with ferns, which symbolize sincerity. english daisy (bellis perennis) symbolizes innocence. they were often paired with primroses, which symbol for childhood and/or moss, which symbolized mother love. daisy flower facts single daisy flower actually made up two separate flowers. center petals one flower surrounded by “rays” another flower. daisies grow all year round. daisies naturally resistant many plant diseases and pests, which makes them perfect flowers for new gardeners. unfortunately, english daisy (bellis perennis) considered stubborn weed in north american lawns. meaningful botanical characteristics daisy flower for centuries, children and really bored child minders have used daisies in order make daisy chains. daisy leaves edible. some people add them their salads. wild daisy tea said be good for ailments throat, for putting on open wounds and as “blood purifier” (whatever means) but aren’t any clinical studies back up these traditional claims. people who allergic ragweed very likely also be allergic daisies or any products made from daisies. daisy flowers message is… daisy’s message is, ultimately, one hope and renewal. in sending daisies, sender hopes viewer will see world as they once did as child. just be sure not send daisies anyone with ragweed allergies.",,Leucanthemum
Dandelion,"common and humble dandelion surprising amount different meanings. dandelion means: healing from emotional pain and physical injury alike intelligence, especially in an emotional and spiritual sense warmth and power rising sun surviving through all challenges and difficulties long lasting happiness and youthful joy getting your wish fulfilled since dandelion thrive in difficult conditions, no wonder people say flower symbolizes ability rise above life’s challenges.","gather up small informal bouquet dandelions from your yard for occasions like: celebrating return summer overcoming an obstacle, especially by using your innate intelligence trying connect with sun and its power celebrating any event brings joy and energy youth into your life dandelion flower’s message is… dandelion flower’s message do not give up, even if those around you keep trying get rid you. stick out and remember cheerfulness sunny summer’s day things seem bleak or dark.",
Delphinium.Txt,"member buttercup family doesn’t sport same cheery yellow color, but it’s still important in mythology and modern symbolism alike. delphinium means reaching for your goals and striving achieve all expanding your options and attracting new opportunities july birthdays protection against dangers, specifically scorpions in ancient lore openness new emotions and feelings, in romantic sense enjoying lighter side life, even troubles get you down celebrating practically anything positive.","grab few dark blue larkspurs you want encourage family member try their best at test or job interview. if you know someone with july birthday, these flowers make perfect gift since it’s birth flower month. delphinium flower’s message is… delphinium flower’s message protect yourself from dangers life so nothing stands in way your success.",
Dogwood,"none dogwood species currently growing native middle east where christianity first developed. however, same symbolism generally applied all types dogwoods regardless native status. tree means: rebirth and resurrection, particularly through story jesus christ christianity as whole pity and regret over specific decision or situation was beyond your control durability and reliability strength and resilience purity, especially in religious or spiritual sense signal affection someone who may not reciprocate many cultures have interacted with tree for medicine or woodworking, yet relatively little symbolism related tree except for christian lore regarding it.","dogwood flowers perfect for: recognizing religious milestone like first communion, baptism, or confirmation celebrating easter and other christian holidays teaching children about crucifixion offering your condolences family after death giving someone might not return your feelings, especially in cases where roses and other love flowers too direct dogwood flower’s message is… after all, i don’t see why i am always asking for private, individual, selfish miracles every year miracles like white dogwood. – anne morrow lindbergh",Cornus
Edelweiss,"edelweiss flower means notoriety in its complete essence. it’s prized where naturally grows and created be symbol by its local region because it’s only obtained by few lies waiting in its natural habitat. it, therefore, captivates symbolic qualities adventure and great sacrifice.","should man be brave and stout, an edelweiss might be right flower profess his love. flower be great symbol love daring men take hold mountains and elevate way through dangers falling and inclement weather. lucky women found be reason for such an occasion will surely know honor man seeking impress her. flower also have been given soothe body diphtheria or tuberculosis. taken as tea, these ailments given relief and was gesture good faith been giving you during sickness. edelweiss flower’s message is: plant honorable qualities, edelweiss, which makes its seeker climb and its lover woo. its nobility found in its upbringing: rare and where only few surely get to.",
Eustoma Flower.Txt,eustoma potent symbol with primarily modern meanings. blossom means long and happy life contentment and peace with you already have appreciation for peace and joy in your life heartfelt emotions towards someone else friendliness and congeniality portraying an air charisma and charm admiration for supportive or loving friend sweetness and kindness towards others and yourself desire be more outgoing.,"grab small bouquet eustoma you’re ready celebrate love you have for friend or as birth flower. course, red and pink varieties also work for deep affection on romantic level. it’s also nice gift give after someone uses their social skills earn promotion or get new job. eustoma flower’s message is… focus on you already have brings you joy. build up your social skills gain more power in world around you without taking advantage others, and create strong bonds with those you love.",
Frangipani,"few different cultures have assigned meanings frangipani flower, including modern american culture. these meanings include: strength withstand tough challenges connecting with spirits and ghosts welcoming guests and inviting them stay, due its use in hawaiian leis intense love and lasting bond between two people immortality and spiritual devotion spread over multiple lifetimes mayans and other mesoamericans held flower in very high esteem, as evidenced by extensive carvings and paintings found feature blooms. however, it’s not currently known exactly plumeria means them. flower still used today in religious rituals from hindu, buddhist, balinese, and swahili cultures.","give gift fragrant frangipani for: weddings, especially between two very compatible people cheering up friend after difficult time honoring spirits loved ones reminding yourself immortality soul frangipani flower’s message is… frangipani flower’s message being delicate and beautiful doesn’t mean you weak or incapable rising meet challenge.",Plumeria
Freesia,beautiful freesia several related meanings. freesia blooms typically mean: innocence thoughtfulness trust friendship sweetness,,
Gardenia,"in victorian times flowers were used convey messages between people. person was unable outright express their feelings love for another, was and still common practice say with flowers. while any type flowering plant will do, if you want express your love and devotion someone but don’t want your identity be known, gardenia flower give as present. signifies secret love or an untold love. gardenias also given convey “you’re lovely”. used in way, gardenia flower be given lovers, friends, and even family. it’s way telling them how lovely they are. and because color gardenia white, also signifies purity. flower wonderful addition wedding bouquet as fits any color theme and also brings message love and purity. other commonly associated meanings are: trust hope purity clarity dreams intuition renewal alignment friendship innocence protection self-reflection",,
Geranium Flower.Txt,"geranium flower appears have some conflicting meanings, which means you must rely on both circumstances and their color refine their meaning. some most common meanings are: folly or stupidity gentility ingenuity melancholy bridal favor unexpected meeting expected meeting preference true friendship",,
