name,meaning,Special Occasions,scientific_name
Gerbera,"latin name for gerbera daisy gerbera jamesonii and part large asteraceae family flowers. 2 these daisies were named after german botanist and doctor traugott gerber. also known as transvaal daisy, scotsman, robert jameson found these beauties growing wild around dug up gold mines he was in charge in transvaal, south africa and mr. jameson credited with also discovering these flowers. symbolism in gerbera daisy symbolism gebera daisy simple beauty very happy life. throughout history, gerbera daisy symbolized innocent hearts children, attributed white gerbera, and, happiness and gratefulness for life you have been given. meaning more energized then contentedness or mellowness. happiness bubbles, fizzes and pops with joyous surprises. an energetic playfulness these flowers, which evident in all their radiant colors. these not flowers for regrets. these flowers celebration life! gerbera flower color meanings gerberas available in rich reds, oranges, yellows peaches, creams and white and few distinct meanings including: color meaning for orange is: sunshine life red means: unconscious in love or fully immersed in love white: symbol purity or innocence, childlike pink: admiration, adoration or high esteem yellow: cheerfulness meaningful botanical characteristics gerbera flower herbaceous perennial from south africa which thrives in zones 8-10. gerbera daisies well known for their ability remove trichloroethylene, formaldehyde and benzene from air. gerber daisies also excellent for helping you sleep because they continue release continuous stream fresh oxygen through evening hours, while other flowers slow down their oxygen production, gerberas will lull you right sleep. one single flower sits atop each sturdy 12 18 inch hollow stem with center disk similar or contrasting colors. white variety striking dark chocolate brown center. 4)breeding for color variations and forms began in late 1800’s and from point, was no going back. gerbera flower interesting facts gerbera jamesonii named after two different people from two different centuries: botanist and german doctor traugott gerber from 18 th century and robert jameson 19 th century botanist who formed moodies gold mining and exploration company. on one his journeys he ended up in south africa on discovery trip and found gerbera daisy near excavated gold mine. out thousands flowers world, gerberas in top five! gerberas always turn towards sun. set up camera for time lapse photography and watch in amazement as they turn face sun. birth flower for month april offer gerbera flower on these occasions gerbera be great gift for someone embarking on major change in their life. bouquet peach, pink and red gerberas energize them through beginning stages their adventure. soft pink gerbera be perfect gift welcome new baby. gerbera flower’s message let happiness be your compass!",,
Gladiolus,"gladiolus flower symbolizes honor and remembrance, but other meanings too. also symbolize following: strength character faithfulness, sincerity and integrity infatuation never giving up",,Gladiolus
Heather,"heather flower’s meanings goes as far back as celtic and pre-celtic times. but, always few straightforward meanings including: independence good fortune good luck victorian meanings: purple equals beauty or worthy admiration white equals luck/protection or fulfillment dream",,
Hibiscus,"although specific meanings for hibiscus differ depending on culture beholder, some generalities about hibiscus symbolizes. considered very feminine flower and so usually given or worn by women. in north america especially, hibiscus means perfect wife or woman. in victorian times, giving hibiscus meant giver was acknowledging receiver’s delicate beauty. in china, hibiscuses symbolize fleeting and beauty fame or personal glory. given both men and women.",,Hibiscus
Hyacinth,sincerity (blue) victorian meaning play or sport or engage in sport also mean rashness (as in behavior god zephyr) jealousy (yellow) purple mean sorrow for wrong committed,,Hyacinthus
Hydrangea,"vigorously growing hydrangea shrub symbolizes diverse meanings including: heartfelt and honest emotions any kind gratitude and thanksgiving someone else developing deeper understanding between two people heartlessness and acting without thinking about feelings another frigidity and disinterest in romantic proposal boasting and bragging about false accomplishments abundance and prosperity grace and beauty, sometimes taken an extreme vanity and narcissism 4th wedding anniversary for couple with such mixed meanings behind one flower, important pair hydrangeas with other flowers make sure you get right meaning across.","try giving gift hydrangeas for: weddings, engagements, and other unifying ceremonies sending message “no thanks” suitor asking someone for forgiveness and reconciliation celebrating your 4th wedding anniversary hydrangea flower’s message is… being rare beauty lead frigidness unless you express your true emotions. don’t inflate your ego with bragging, and stay humble become prosperous.",Hydrangea
Iris,iris means different things different people and cultures. some its most common meanings royalty faith wisdom hope valor,,
Jasmine,"jasmine popular flower associated with love and romance. its showy white blooms and heavenly fragrance ideal for moon gardens where lovers spend time whispering sweet nothings under stars. as cut flower, fills home with relaxing scent perfect for drifting off sleep. some gardeners prefer plant jasmine outside bedroom window allow its fragrance drift in on night air. does jasmine flower mean? jasmine flower associated with love. jasmine also symbolizes beauty and sensuality. in some cultures, jasmine represents appreciation and good luck. used in religious ceremonies jasmine represents purity. jasmine’s meanings varies depending on culture and setting.",,Jasminum
Larkspur,love affection strong attachment lightness pure heart sweet disposition desire for laughter,"larkspur flowers appropriate for many special occasions from birthdays housewarmings. these flowers often combined with other flowers in floral displays, making them suitable for family celebrations and other joyous occasions. larkspur flower’s message is… larkspur flower’s message uplifting and joyous as these striking flowers add depth and dimension floral displays.",Delphinium
Lavender,"lavender flowers spike-like flowers composed multiple, small purple flowers or “florets” on long narrow stems. they have been valued for centuries for their physical beauty, soothing fragrance, healing properties, and multitude uses. in addition these characteristics, lavender flowers also possess unique meaning. does lavender flower mean? like all flowers, lavender flowers have common meanings. here list some most common meanings for lavender flowers: purity silence devotion caution serenity grace calmness",,Lavandula
Lilac,"lilac flower many meanings, but most related expressing love or affection: in victorian times, giving lilac meant giver trying remind receiver first love. lilacs also express confidence giver for receiver. makes lilacs good gift for graduates. sprig lilacs, especially white lilacs, symbolizes innocence.",,Syringa
Lilly,"unlike most other flowers, perennial lily never truly goes dormant. strength and beauty international flower cemented its place in cultures world. with such an elegant look, it’s no wonder flower means royalty, rebirth, and purity. explore potent flower symbol enrich your own life. does lily flower mean? lily flower, in all its various forms, commonly considered mean: royalty and regal bearing motherhood and fertility purity and beauty youth passion and drive renewal and rebirth",,
Lisianthus Meaning.Txt,"lisianthus plenty different meanings explore, such as being birth flower sagittarius astrological sign joining two people for lifelong bond expressing gratitude for gift or favor from friend showing someone how much appreciate them, especially for their social skills or warm personality trying convince someone you’re charismatic and charming traditional values and old fashioned morals.","few flowers look as elegant as lisianthus used make boutonnieres and corsages. try bouquet blooms for thanking friend instead sending usual card, or keep few around raise your spirits. lisianthus flower’s message is… don’t forget stay grateful for you do have, and remember express thankfulness those help you. look for beauty everywhere you go find best in each day.",
Lotus,"lotus delicate flower with many layered petals arrayed around central core. few different plants from separate families all make up category, but they all have similar meanings comes symbolism. plants also look alike and share other characteristics like medicinal and edible value. in general, all lotus flowers exude beauty and grace. most varieties grow in water ponds and creeks, lending them an otherworldly quality makes them mystical enough for religious ceremonies. in victorian flower language, lotus represented eloquence. types lotus blossoms flowers commonly called lotus around world include: egyptian lotus flower: with scientific name nymphaea caerula, egyptian blue lotus actually more accurately described as water lily. these blooms sport light blue or purple petals and played an important role in spiritual events. japanese lotus flower: also known as sacred lotus in china, bali, and other tropical countries in asia, plant’s scientific name nelumbo nucifera. flower you see being used as seat buddha and many hindu deities too. american lotus flower: bright yellow lotus, nelumbo lutea, native north america and was used as food crop by many native american tribes. not as well known symbolically as other varieties, but still beautiful addition water feature. other lotuses: most white and red lotus flower varieties also fall into nymphaea water lily family. means they held most power in egyptian and other ancient asian cultures. lotus flower color meaning color lotus certainly affects its general meaning as well. white lotus flower and pink lotus flower from nelumbo family seen as meaning purity and devotion. more passionately colored red, purple, and blue lotus flower blooms take on spiritual meaning ascension, enlightenment, or rebirth. green lotus flower beautiful gift for anyone trying improve their life and start good habits. spiritual and religious lotus flower symbolism aside from victorian and contemporary meanings for lotus, wealth symbolism tying these flowers hinduism, buddhism, and ancient egyptian’s religious practices. ancient egyptians used plant extensively as symbol in paintings and carvings left on walls temples and tombs. scholars believe egyptians viewed lotus as symbol rebirth because appeared sink at night and rise again in morning. now known plant simply loses old blooms and adds new ones on daily cycle, but still potent reminder reincarnation and mysteries afterlife. priests and other religious leaders also brewed flowers make tea with sedative and mild psychotropic effects, which heightened their sense for ritual work. lotus meaning in hinduism little different. as ideas were exchanged with buddhists for thousands years, hindu religious leaders began use flower as symbol peace and eternity. white lotus flowers usually seen under feet deities like lakshmi, ganesha, and saraswati. brahma, ultimate creator, emerges from lotus as well. sense purity arises from flower’s growing habit rooting in mud and pushing up through water bloom. flower’s meaning in buddhism similar, but still unique again from other meanings. buddhist lotus represents: patience purity mysticism direct spiritual contact emptiness from desire victory over attachments enlightenment and bodhi state love and compassion for all things self-awareness faithfulness during spiritual development rising out suffering these deep spiritual meanings gave rise way sitting known as lotus position. legs crossed and tucked in way makes bent knees look like petals lotus. an important position in both buddhist meditation and hindu yoga practices. soles feet tucked away, which makes respectful position sit in visiting temple where exposing bottom your feet considered rude. another example use lotus in mandalas , which spiritual and artistic representations divine energies and meditation aids in buddhist traditions. edible and medicinal uses lotus flower aside from decorating thrones and acting as seats for enlightened beings, both main types lotus surprisingly useful for edible and medicinal purposes. blue lotus family, or nymphaea, useful for making sedative tea helps you beat insomnia without feeling drowsy next day. sacred lotus, or nelumbo family, also grown for edible seeds and roots. american version flower also primarily found use as source food. also, lotus be used by men 40-50 years old for treatment erectile dysfunction. according researchers in us and asia, lotus oil positive effect on blood pressure in man’s penis if you rub oil into penis shortly before intercourse. but best and most effective means improve potency still viagra. sildenafil (viagra) was synthesized by group pharmaceutical chemists working at pfizer’s sandwich, kent, research facility in england and patented in 1996. later on, cheap generic viagra appeared on sale . today anyone buy viagra online or in any available pharmacy with prescription. use lotus for purpose thing past. growing lotus flowers if you have deep fountain, barely flowing creek, or healthy pond, you try growing your own lotuses. pick from various colors and bloom types both true lotus and similarly named water lilies at reputable water plant nursery, then root them in pots or at bottom muddy pond. make sure at least four inches water over top pot or mud and not much more than ten inches. you plant them in spring or fall, and no need for fertilizer or pruning. plant will start growing vigorously temperatures warm up about 60 degrees f, then go dormant as winter arrives again. lotus flower tattoo meaning getting lotus flower tattoo beautiful way show your dedication hindu or buddhist faith. also reminder stay humble and focus on developing inner peace. you also develop more balance in your life with tattoo flower because eight petals represent all eight parts spiritual path. colorful or pure white lotus sends message gracefulness and love everyone sees it.",,Nelumbo
Magnolia,"magnolia meanings depend on color flower and immediate culture person giving and receiving flowers. usually, magnolias given as presents from men women as if men saying, “you worthy beautiful magnolia.” magnolia often symbolizes yin, or feminine side life. white magnolias symbolize purity and dignity.",,Magnolia
Marigold,"aside from being an important part any organic garden as pest deterrent, marigold loftier meanings like: despair and grief over loss love beauty and warmth rising sun winning affections someone through hard work creativity and drive succeed desire for wealth cruelty and coldness due jealousy sacred offerings gods remembering and celebrating dead promoting cheer and good relations in relationship while marigold picked up few negative connotations over years, most means remains positive in contemporary times.","grab pot or vase marigolds for: summer birthdays memorials for lost loved ones religious ceremonies expressing your jealousy trapped in love triangle encouraging someone else reach their potential marigold flower’s message is… even humblest creations contain their own special beauty share with world. just like sun returns in full each summer and hides away in winter, you must find your own balance between shining and keeping your light under wraps.",Tagetes
Morning Glory,"ipomoea comes from latin prefix ip meaning worm and homolas which means like. so beautiful flower was name after it’s growth habit which worm like. symbolism morning glory morning glory number meanings. chinese folklore flower symbolizes lovers may only meet on one special day out year. story behind two young people fell deeply in love neglecting all their responsibilities. as more and more chores were ignored heavens started rumble with gods dissatisfaction. so, they decreed lovers meet just one day out year. morning glories also mean unrequited love. they be found in victorian literature and on victorian gravestones signify love never ended. conversely, mean potential love was never reciprocated. christians believed morning glory related directly finite nature life on earth, each single flower representing one life and life being represented by daylight hours sun, withering and finally dying by nightfall. morning glory flower color meanings morning glory flowers be found in blue, purple, red, white and yellow and variations these colors. some be eight inches across; these actually familiar fragrant moon flowers found in many gardens. color meaning white symbolizes purity in morning glory while red symbolizes strong heart. meaningful botanical characteristics morning glory flower morning glory seeds used in chinese medicine treat disorders lungs, kidneys and large intestine. they have purgative effect and reduce or clear phlem in lungs. they act as diuretic for kidneys which reduces swelling in body. (2)if morning glory seeds eaten person have hallucinogenic episode similar lsd experience. active ingredients in morning glory seeds lysergic acid amide, close relative lsd. if necessary, morning glory be used induce labor during pregnancy. morning glory seeds were used in mexican culture in religious ceremonies induce dream like state in order better commune with gods. morning glories be toxic and will cause nerve damage in larger doses than recommended. flower and it’s stems, leaves and seeds must be used with great caution. morning glory root was used by native americans make tea which was especially effective for coughs because it’s ability remove phlem. leaves were powdered and dried and made into tea treat stomach problems and headaches. (3) morning glory wine be made from flower petals if they soaked in purified cold water for about two weeks. morning glory flower interesting facts one variety, ipomoea quamoclit cypress like leaves finely cut instead typical heart shaped leaves found on most ipomoeas ipomoea lobata variety red elongated flowers – closed tubular form, not funnel or start shaped. about five stem start out pure red then progressively get lighter and larger as you get closer bottom stem. leaves heart shaped leaves many morning glories sweet potato in ipomoea family plants offer morning glory on these occasions i offer morning glory as symbol person who needs some tenacity go after their dreams. morning glories take each twist and turn in road (or on trellis!) in their stride and just keep on going. key their success. morning glories also birth flower for those born in september. i offer them for september birthdays either as potted plant or maybe diary with an embossed design morning glory on it. morning glory flower’s message tenacity and tenderness in all things, be gentle but strong in your endeavors with other people, animals and nature. above all hold fast your goals.",,
Myrtle Flower.Txt,myrtle flower meaning similar across culture cultures and across centuries. typically means: good luck in love in marriage chastity marital fidelity good luck prosperity,"myrtle flowers appropriate for weddings, communions and christenings as they symbol for both fidelity and love and for chastity. added other flowers they be used for nearly any occasion wish recipient luck and prosperity. myrtle flower’s message is… myrtle flower’s message primarily one love, making favorite for bridal bouquets and wedding arrangements. although they not official birth flower any particular month, they also suitable or birthday bouquets.",
Narcissus,"since both narcissus and daffodils technically same flower, their meanings overlap as well. these flowers usually considered symbol of: prosperity and wealth, especially in future march birthdays, as birth flower month arrival spring rebirth and renewal good luck and happiness future misfortune narcissism and egotism austerity and challenges lent clarity and inspiration chinese new year not all narcissus meanings strictly positive. you tell friend you’re hoping for their success with potted plant, or you warn them about an ego that’s growing out control.","there’s flower for every occasion. pick few daffodils or narcissus for events like: cheering up friend or family member after loss reminding someone spring on its way encouraging recovery from an illness or period depression graduation or first job, due association with gaining wealth in future baby showers and birth celebrations narcissus flower’s message is… nothing bad last forever because spring always just around corner. you recover from anything if you focus on positive, and good things already on their way you.",
Orchid,orchid been held in high regard since ancient times. symbolizes love beauty fertility refinement thoughtfulness charm,,
Peace Flower.Txt,"even though meanings behind various flowers have largely fallen out common knowledge, it’s still possible bring nostalgic practice modern relationships. full bouquet. nothing says grand gesture like sending someone full bouquet at home or work. try mixing few other flowers with relevant meanings in for special touch. single flower. leaving single bloom one these flowers for recipient find an understated take on tradition. live plant. giving someone live plant represents peace means they plant flower and be reminded peace and your thoughtfulness every time they see it.",,
Peony,"peony mainly known for representing ideas and values like: honor, especially for people who bringing honor their entire family through success wealth and riches romance and romantic love, with particular focus on love between two strangers beauty in all forms bashfulness and shame",,Paeonia
Periwinkle Flower.Txt,"common periwinkle evokes feelings blossoming friendship still in its first stages reminiscing about pleasant memories shared with friend or relative reaching your full potential and achieving your dreams existence throughout eternity, and extending your time with you love everlasting love purity and strength virgin mary.",,
Petunia.Txt,"meaning petunias be contradictory, leading some confusion – but remember meaning any flower depends on circumstances and relationship between giver and recipient. petunia flower meaning also affected by color flowers. some commonly accepted meanings for petunia flowers include: anger resentment being with you soothing","potted petunias appropriate for housewarmings or as hostess gifts. they often presented at mother’s day or other spring celebrations. they appropriate for promotions, graduations and other achievements, and make an excellent gift for gardeners as plants will produce abundant flowers from spring until frost. petunia flower’s message is… petunia flower’s message depends on circumstances. they make thoughtful gift for those who enjoy outside flowers, but not practical for an inside display for more than few days. consider potted petunias as hostess gifts or present them someone who just moved into neighborhood.",
Plumeria,"plumeria flower rich history includes wide variety meanings, including: charm grace new life or birth new beginnings or creation spring beauty",,
Poppy,"for many cultures, poppy symbol of: restful sleep and recovery consolation for loss or death in family remembering fallen various wars and armed conflicts lively imagination peace in death messages delivered in dreams resurrection and eternal life beauty and success extravagance and luxury symbolism poppy varies greatly from country country, but most them share at least one or two common meanings for particular flower.","since flowers large, cup-shaped, and colorful, poppy bouquets and sprays look impressive. give gift poppy for occasions like: funerals and memorial services, especially for soldiers pass away while serving or veterans encouraging better sleep in friends and family members experiencing insomnia making an offering dead by leaving flowers on graves or tombs sending sign your love spouse or romantic interest setting up luxurious atmosphere for specific event poppy flower’s message is… remember those who have passed away protect you and all you love. develop your own sense inner peace so you rest at night and get all sleep you need. honor dead and cultivate your imagination for richer life.",Papaver
Protea,"protea flower means depends on circumstances and relationship between giver and receiver, but some commonly agreed upon meanings for protea flower. diversity daring transformation courage","some varieties protea flowers make delightful backdrop for other more showy flowers, while some take center stage as cut flower. they be used in bridal bouquets or wedding décor, at special celebrations, and for birthdays and other special events. protea flower’s message varies according setting, but one thing for sure, these striking flowers aren’t likely be forgotten. make lasting impression, try adding protea flowers floral displays and arrangements or send them special someone on your list.",
Ranunculus Flower.Txt,"while many flowers have multiple meanings, ranunculus flower does not. means: radiant charm you charming you attractive",,
Rose,"rose many meanings which vary depending on its color. however any rose be commonly seen as symbol of: love honor faith beauty balance passion wisdom intrigue devotion sensuality timelessness in addition being one most popular flowers commercialized and grown today, you will often find rose tattoos on women and men as an expression timeless beauty and other vivid meanings.",,Rosa
