name,meaning,Special Occasions,scientific_name
Sampaguita,"love fidelity devotion dedication purity divine hope sampaguita flower considered flower love in many south asian countries, indonesia and philippines. used in wedding and religious ceremonies symbolize love, devotion, purity and divine hope.","sampaquita flowers appropriate for weddings and other religious ceremonies, but also be included in floral bouquets presented mothers, grandmothers and close female friends express love and dedication. bouquet sampaquita flowers in bedroom or dining area sets mood for love and romance. sampaguita flower’s message is: sampaguita flower’s message one love and devotion and sure be appreciated by special women in your life.",
Snapdragon,"snapdragons possess two meanings. similar mythical creature they resemble, revered in some cultures and feared in others: snapdragon means grace and, due its growth in rocky areas, strength. however, also symbolize deviousness.",,Antirrhinum
Snowdrop,snowdrop flower several meanings depending on context. most common meanings are: purity hope rebirth consolation or sympathy,"snowdrops appropriate either as an expression sympathy or as an expression celebration. presented wedding party, floral display with snowdrops speaks optimism and hope. they symbolize sympathy given on solemn occasion such as after death, loss or misfortune. snowdrop flower’s message is: snowdrop flower’s message typically positive, signifying hope, rebirth and bright future.",
Star Of Bethlehem Meaning.Txt,"star bethlehem flower associated with birth christ and symbolizes traits jesus. innocence purity honesty hope forgiveness often used in religious ceremonies as symbol christ child, but be used for other occasions, too.","star bethlehem flower appropriate in nearly any floral arrangement from weddings and christenings birthdays and anniversaries. star bethlehem flower’s message is… star bethlehem flower’s message carries with hope for future, innocence, purity, trust and honesty making an ideal flower for adding wedding décor and bridal bouquets.",
Stargazer Meaning.Txt,,"aside from 30th anniversary, you should also invest in bunch stargazers your family home needs breath fresh air due pessimistic atmosphere. keep fresh vase flowers on your desk at work stay motivated working towards your future. finally, consider using bloom celebrate graduation high school or college student. stargazer flower’s message is… stargazer flower’s message keep your eyes on heavens instead always staring at ground. stay positive and watch as world changes around you.",
Statice.Txt,"meaning statice flower depends on occasion or event, but some commonly accepted meanings for statice. remembrance sympathy success statice’s primary meaning one remembrance, making common flower in memorial wreaths and bouquets.","statice versatile flower appropriate for nearly any occasion, particularly used as filler in mixed floral arrangements. these flowers work well for reunions, get-togethers among old friends or for birthdays and other celebrations. they common in funeral flowers or for memorial services, but they don’t need be part solemn event, as they symbolize success as well as remembrance. tucked into floral arrangements add delicate color, these flowers right at home in office bouquets or for special events like graduations and other achievements. statice flower’s message statice flower’s message varies depending on circumstances. while express sympathy and fond memories, also be symbol for success. use meaning flower colors and other flowers in arrangement guide you in choosing in bouquet with statice flowers.",
Stock Flower.Txt,"stock flower attracts attention for both its distinctive blossoms and delicate and wonderful scent releases. aside from its physical characteristics, plant popular as symbol long life full happiness and success contentment with your life way right now beauty doesn’t fade with age or time achieving paradise on earth dedicating oneself life spiritual purity connecting with world as one.","stock ideal for first communions weddings anniversaries and birthdays positive life changes like relocations and new children. stock flower’s message is… enjoy life you have before gone. love and beauty and both eternal, if you believe in them.",
Tulip,"while it’s not fanciest flower in garden, beauty and grace simple tulips means flower become symbol for meanings like: perfect, enduring love between partners or family members undying passionate love, whether passion spurned or returned royalty and regal nature forgotten or neglected love 11th wedding anniversary abundance, prosperity, and indulgence charity and supporting less fortunate",,Tulipa
Wisteria Flower.Txt,"wisteria been growing in eastern us and asia for centuries now, so accumulated plenty contrasting and complementing meanings. some people believe wisteria symbolizes good luck, especially for start business or new marriage welcoming someone new town or home celebrating youthful vitality young friend or child expressing your affections after meeting someone special for first time serious devotion, whether it’s cause or another person new births and spring birthdays wisteria isn’t specific birth flower for any months, but many people associate with march and april because blooms during those months.","celebrate new family member by sending in bundle blossoms, or give blue wisteria as “something blue” for wedding tradition. wisteria flower’s message is… wisteria flower’s message let good luck make your adventures go little smoother. celebrate new beginnings in life instead focusing on endings.",
Zinnia,"? zinnia flower several meanings including thoughts friends, endurance, daily remembrance, goodness and lasting affection. victorian meaning zinnias thoughts an absent friend heart lasting affection daily remembrance",,Zinnia
